{
  "$schema": "../schemas/cartridge-board.schema.json",
  "id": "nes.board.konami-vrc6.mapper24",
  "name": "Konami VRC6a",
  "mapper": 24,
  "components": [
    {
      "id": "mapper",
      "type": "KonamiVrc6Cartridge",
      "role": "VRC6 ASIC with direct register A0/A1 package wiring, PRG/CHR/nametable banking, RAM gate, IRQ and expansion audio"
    },
    {
      "id": "irq",
      "type": "KonamiVrcIrqCounter",
      "role": "Reusable Konami VRC 8-bit reload/counter and 341-dot scanline prescaler circuitry"
    },
    {
      "id": "audio",
      "type": "KonamiVrc6Audio",
      "role": "Chip-internal two-pulse plus sawtooth expansion-audio generator"
    }
  ],
  "connections": [
    "Cpu.Bus -> mapper.Cpu",
    "Ppu.Bus -> mapper.Ppu",
    "mapper.PrgBank16/PrgBank8 -> PrgRom bank address inputs",
    "mapper.ChrBank0..7 + BankingMode -> ChrRom bank address inputs",
    "mapper.NametableRouting -> Motherboard.Ciram or ChrRom",
    "mapper.IrqControl -> irq",
    "irq.IrqBar -> mapper.IrqBar -> Cpu.IrqBar",
    "Cpu.M2 -> mapper.AudioClock -> audio"
  ],
  "notes": "Mapper 24 identifies VRC6a register wiring. Expansion audio remains a cartridge-local physical output until a generic analog cartridge-connector path is modeled."
}
