{
  "$schema": "../schemas/cartridge-board.schema.json",
  "id": "nes.board.nina",
  "name": "NINA-03/NINA-06",
  "mapper": 79,
  "components": [
    {
      "id": "mapper",
      "type": "ReusableMapperHardware",
      "role": "nina-03/nina-06"
    }
  ],
  "connections": [
    "Cpu.Bus -> mapper.Cpu",
    "Ppu.Bus -> mapper.Ppu"
  ],
  "notes": "Composable NINA-03/NINA-06 board built from shared PRG, CHR, mirroring, RAM and IRQ components."
}
