{
  "$schema": "../schemas/cartridge-board.schema.json",
  "id": "nes.board.mmc3",
  "name": "MMC3/MMC6",
  "mapper": 4,
  "components": [
    {
      "id": "mapper",
      "type": "Mmc3Cartridge",
      "role": "package-local PRG/CHR bank muxes, mirroring, RAM protection and filtered A12 IRQ counter"
    }
  ],
  "connections": [
    "Cpu.Bus -> mapper.Cpu",
    "Ppu.Bus -> mapper.Ppu",
    "mapper.Ciram -> Motherboard.Ciram",
    "mapper.IrqBar -> Cpu.IrqBar"
  ],
  "notes": "Mapper 4 is constructed as replaceable external hardware. Generic compiler support for address-only bus observation is product-agnostic and exists so edge-sensitive packages can watch physical bus pins without driving data."
}
