{
  "$schema": "../schemas/cartridge-board.schema.json",
  "id": "nes.board.camerica",
  "name": "Camerica",
  "mapper": 71,
  "components": [
    {
      "id": "mapper",
      "type": "ReusableMapperHardware",
      "role": "camerica"
    }
  ],
  "connections": [
    "Cpu.Bus -> mapper.Cpu",
    "Ppu.Bus -> mapper.Ppu"
  ],
  "notes": "Composable Camerica board built from shared PRG, CHR, mirroring, RAM and IRQ components."
}
